{
  "schema_version": 1,
  "schedule_id": "glm52-indexer-distillation-runpod-v1",
  "execution_site": "runpod_hopper",
  "ordered": true,
  "gpu_assumptions": {
    "accelerator": "4x H200 141GB",
    "tensor_parallel_size": 4,
    "compute_capability": "9.0",
    "minimum_free_memory_mib_per_gpu_before_load": 135000,
    "base_image": "audited RunPod Ubuntu 22.04 host with CUDA 12.9; no container image substituted",
    "python": "3.12",
    "torch": "2.13.0+cu129",
    "cuda": "12.9",
    "no_gpu_work_on_montblanc": true
  },
  "tests": [
    {
      "ordinal": 1,
      "test_id": "glm52-runpod-doctor-v1",
      "depends_on": [],
      "dependency_evidence": null,
      "setup_command": "PYTHON_BIN=/workspace/Putpocket_env/bin/python ./scripts/runpod/bootstrap_glm52_attention_indexer.sh /workspace/vllm /workspace/artifacts/test1/bootstrap.json && uv pip install --python /workspace/Putpocket_env/bin/python --no-build-isolation --no-deps -e /workspace/vllm",
      "command": "./scripts/runpod/run_glm52_runpod_doctor.sh /workspace/vllm /workspace/models/aec724e8c7b8ee9db3b48c01c320f63f9cdaf8aa $(git rev-parse HEAD) /workspace/artifacts/test1/doctor.json /workspace/Putpocket_env/bin/python",
      "inputs": [
        "exact checked-out PutPocket branch commit",
        "clean vLLM checkout at 4a3447d200e5aa428d68d1a00aa00f1a19a1a729",
        "local model snapshot at revision aec724e8c7b8ee9db3b48c01c320f63f9cdaf8aa with revision marker",
        "four visible full H200 GPUs"
      ],
      "outputs": [
        "/workspace/artifacts/test1/bootstrap.json",
        "/workspace/artifacts/test1/doctor.json with payload_sha256"
      ],
      "artifact_retention": [
        "bootstrap JSON",
        "doctor JSON",
        "editable-build log",
        "exact project and vLLM commits"
      ],
      "success_criteria": [
        "all structured doctor checks pass",
        "all three overlays and instrumentation match exact postimage hashes",
        "CUDA, BF16, TP4 H200 memory, NCCL, FLASHMLA_SPARSE, and DEEPSEEK_V32_INDEXER checks pass",
        "true-partial, legacy emulation, and score diagnostic flags are default OFF"
      ],
      "failure_policy": "fail closed on any environment, source, patch, model, tokenizer, backend, distributed, or feature-default mismatch",
      "estimated_duration": "15-45 minutes after a fresh pod opens, dominated by explicit vLLM source build/import JIT"
    },
    {
      "ordinal": 2,
      "test_id": "glm52-main-indexer-score-compare-v1",
      "depends_on": ["glm52-runpod-doctor-v1"],
      "dependency_evidence": "doctor.payload_sha256",
      "setup_command": "git -C /workspace/SWE-bench_Pro-os rev-parse HEAD | grep -Fx ca10a60a5fcae51e6948ffe1485d4153d421e6c5 && git -C /workspace/SWE-bench_Pro-os/mini-swe-agent rev-parse HEAD | grep -Fx d74716a3c8104a113f77cc9ab94cf407ecdcf1e9 && test -f /workspace/artifacts/test1/doctor.json",
      "command": "./scripts/runpod/run_glm52_attention_indexer_score_test.sh /workspace/models/aec724e8c7b8ee9db3b48c01c320f63f9cdaf8aa /workspace/SWE-bench_Pro-os /workspace/artifacts/test1/doctor.json /workspace/artifacts/test2 /workspace/Putpocket_env/bin/python",
      "inputs": [
        "successful immutable doctor payload digest",
        "pinned ScaleAI/SWE-bench_Pro row and pinned SWE-bench Pro harness",
        "PutPocket-authored glm52-sys-policy-equal-replacement-v1 deterministic two-query diagnostic probe",
        "local exact model snapshot and patched vLLM"
      ],
      "outputs": [
        "/workspace/artifacts/test2/frozen-two-query-probe.json",
        "/workspace/artifacts/test2/query-sum-capture/capture-rank-*.jsonl",
        "/workspace/artifacts/test2/query-sum-report/query-sum-attention-indexer-report.json",
        "/workspace/artifacts/test2/query-sum-report/query-summed-token-scores.jsonl",
        "/workspace/artifacts/test2/matrix/matrix-rank-*-chunk-*.jsonl",
        "/workspace/artifacts/test2/multihop/indexer-multihop-report.json",
        "/workspace/artifacts/test2/SHA256SUMS",
        "optional: /workspace/artifacts/test2/matrix/matrix-rank-*-chunk-*.jsonl"
      ],
      "artifact_retention": [
        "doctor dependency JSON",
        "immutable serialized prompt, token IDs, Q1/Q2 ranges, provenance, and no-outcome attestation",
        "all per-rank raw per-query capture records for every Q1/Q2 content-token row",
        "token-aligned query-summed vectors plus per-query rows",
        "aggregate report and SHA256SUMS",
        "server/model load logs and HBM inventory",
        "when explicitly requested: frozen matrix episode, per-rank chunked raw matrix, offline multihop report and token rows"
      ],
      "success_criteria": [
        "all Q1/Q2 content-token layer/query/TP cells captured and aligned",
        "main full-candidate reference logits and native pre-top-k indexer vectors are finite and causally coindexed",
        "report and token-level artifacts validate against schemas and hashes",
        "similarity result is reported without an unregistered pass threshold"
      ],
      "failure_policy": "fail on capture, alignment, finite-value, TP-consensus, schema, or digest errors; do not fail merely because the unknown scientific similarity is low",
      "estimated_duration": "60-180 minutes including two TP4 model loads, bounded all-query reference capture, and bounded strict-causal matrix capture"
    }
  ],
  "postprocessors": [
    {
      "postprocessor_id": "glm52-raw-indexer-multihop-offline-v1",
      "gpu_test_ordinal": 2,
      "default_enabled": false,
      "depends_on_artifact": "complete strict-causal raw indexer matrix plus frozen matrix-episode manifest",
      "capture_command": "executed by scripts/runpod/run_glm52_attention_indexer_score_test.sh after the all-Q1/Q2 query-sum capture, using the same frozen prompt/window/layers",
      "command": "/workspace/Putpocket_env/bin/python -m putpocket_dataset_mining.glm52_runpod_cli score-matrix --episode-manifest /workspace/artifacts/test2/frozen-matrix-episode.json --capture-root /workspace/artifacts/test2/matrix --output-root /workspace/artifacts/test2/multihop --q1-range FROZEN_START:END --q2-range FROZEN_START:END --window FROZEN_START:END --layers 0,22,46,74 --max-level 6",
      "cost": "Capture storage and validation are O(layers * window_tokens^2); propagation is bounded by the same declared matrix.",
      "hard_caps": {
        "window_tokens": 2176,
        "raw_edge_values_per_rank": 9465600,
        "propagation_level": 16
      },
      "outputs": [
        "/workspace/artifacts/test2/multihop/indexer-multihop-report.json",
        "/workspace/artifacts/test2/multihop/indexer-multihop-token-scores.jsonl"
      ],
      "success_criteria": [
        "every requested layer has one unique strict-causal row for every query in the declared window on every TP rank",
        "the offline float64 recurrence, input hashes, per-hop contributions, cumulative scores, and exact unnormalized layer sums validate",
        "no score threshold or inference decision is introduced"
      ]
    }
  ]
}
